{"schema":"archie-research-allocation/v1","campaign_id":"archie-generation-one","policy_version":"archie-generation-one-constitution/v1","total_credits":100,"evaluation_reserve":20,"discovery_credits":80,"owner_preference_axis":{"separate_from_capability":true,"continuing_compute_weight":0,"promotion_veto":false,"description":"Owner preference is reported independently and cannot alter lane priority, capability score, or continuing-compute admission."},"lanes":[{"id":"dense-transformers-post-training","name":"Dense transformers and post-training","credits":16,"task_families":["language-modeling","instruction-following","tool-use","post-training"],"allowed_worker_kinds":["local_cpu","wsl_workstation","github_hosted_cpu","self_hosted","remote_http","burst_gpu"],"required_capabilities":["trainable-model","artifact-receipts"],"max_cost_usd_per_experiment":40,"required_replications":2,"stop_rules":{"max_failed_attempts":4,"max_integrity_rejections":1,"stop_on_authority_regression":true},"promotion_boundaries":{"minimum_seeds":3,"independent_evaluation":true,"matched_compute":true,"no_authority_regression":true}},{"id":"sparse-experts-modular-routing","name":"Sparse experts and modular routing","credits":8,"task_families":["expert-routing","conditional-compute","modular-composition"],"allowed_worker_kinds":["wsl_workstation","self_hosted","remote_http","burst_gpu"],"required_capabilities":["trainable-model","routing","artifact-receipts"],"max_cost_usd_per_experiment":30,"required_replications":2,"stop_rules":{"max_failed_attempts":4,"max_integrity_rejections":1,"stop_on_authority_regression":true},"promotion_boundaries":{"minimum_seeds":3,"independent_evaluation":true,"matched_compute":true,"no_authority_regression":true}},{"id":"state-space-recurrent-models","name":"State-space and recurrent models","credits":8,"task_families":["long-context","sequence-modeling","recurrent-state"],"allowed_worker_kinds":["local_cpu","wsl_workstation","self_hosted","remote_http","burst_gpu"],"required_capabilities":["trainable-model","recurrent-state","artifact-receipts"],"max_cost_usd_per_experiment":30,"required_replications":2,"stop_rules":{"max_failed_attempts":4,"max_integrity_rejections":1,"stop_on_authority_regression":true},"promotion_boundaries":{"minimum_seeds":3,"independent_evaluation":true,"matched_compute":true,"no_authority_regression":true}},{"id":"test-time-search-latent-recurrence","name":"Test-time search and latent recurrence","credits":10,"task_families":["planning","search","verification","latent-recurrence"],"allowed_worker_kinds":["local_cpu","wsl_workstation","github_hosted_cpu","self_hosted","remote_http","burst_gpu"],"required_capabilities":["search","bounded-execution","artifact-receipts"],"max_cost_usd_per_experiment":25,"required_replications":2,"stop_rules":{"max_failed_attempts":5,"max_integrity_rejections":1,"stop_on_authority_regression":true},"promotion_boundaries":{"minimum_seeds":3,"independent_evaluation":true,"matched_compute":true,"no_authority_regression":true}},{"id":"test-time-memory-continual-adaptation","name":"Test-time memory and continual adaptation","credits":8,"task_families":["memory","retention","adaptation","negative-knowledge"],"allowed_worker_kinds":["local_cpu","wsl_workstation","github_hosted_cpu","self_hosted","remote_http"],"required_capabilities":["mutable-state-isolation","retention-evaluation","artifact-receipts"],"max_cost_usd_per_experiment":20,"required_replications":2,"stop_rules":{"max_failed_attempts":4,"max_integrity_rejections":1,"stop_on_retention_regression":true},"promotion_boundaries":{"minimum_seeds":3,"independent_evaluation":true,"retention_gate":true,"no_authority_regression":true}},{"id":"neuro-symbolic-program-synthesis","name":"Neuro-symbolic reasoning and program synthesis","credits":7,"task_families":["symbolic-reasoning","program-synthesis","proof-search","constraint-solving"],"allowed_worker_kinds":["local_cpu","wsl_workstation","github_hosted_cpu","self_hosted","remote_http"],"required_capabilities":["program-execution","verification","artifact-receipts"],"max_cost_usd_per_experiment":18,"required_replications":2,"stop_rules":{"max_failed_attempts":5,"max_integrity_rejections":1,"stop_on_unsafe_execution":true},"promotion_boundaries":{"minimum_seeds":3,"independent_evaluation":true,"executable_outputs":true,"no_authority_regression":true}},{"id":"world-causal-model-based-control","name":"World models, causal models, and model-based control","credits":6,"task_families":["simulation","causal-inference","model-based-control","counterfactuals"],"allowed_worker_kinds":["local_cpu","wsl_workstation","self_hosted","remote_http","burst_gpu"],"required_capabilities":["simulator","bounded-control","artifact-receipts"],"max_cost_usd_per_experiment":22,"required_replications":2,"stop_rules":{"max_failed_attempts":4,"max_integrity_rejections":1,"stop_on_authority_regression":true},"promotion_boundaries":{"minimum_seeds":3,"independent_evaluation":true,"intervention_gate":true,"no_authority_regression":true}},{"id":"concept-level-multiscale-representations","name":"Concept-level and multiscale representations","credits":4,"task_families":["representation-learning","abstraction","hierarchical-composition"],"allowed_worker_kinds":["local_cpu","wsl_workstation","github_hosted_cpu","self_hosted","remote_http"],"required_capabilities":["representation-learning","artifact-receipts"],"max_cost_usd_per_experiment":15,"required_replications":2,"stop_rules":{"max_failed_attempts":4,"max_integrity_rejections":1,"stop_on_non_executable_hypothesis":true},"promotion_boundaries":{"minimum_seeds":3,"independent_evaluation":true,"executable_outputs":true,"no_authority_regression":true}},{"id":"evolutionary-population-meta-learning","name":"Evolutionary, population, and meta-learning","credits":5,"task_families":["population-search","evolution","meta-learning","architecture-search"],"allowed_worker_kinds":["local_cpu","wsl_workstation","github_hosted_cpu","self_hosted","remote_http","burst_gpu"],"required_capabilities":["population-manager","fenced-execution","artifact-receipts"],"max_cost_usd_per_experiment":20,"required_replications":2,"stop_rules":{"max_failed_attempts":6,"max_integrity_rejections":1,"stop_on_budget_exhaustion":true},"promotion_boundaries":{"minimum_seeds":3,"independent_evaluation":true,"lineage_receipts":true,"no_authority_regression":true}},{"id":"retrieval-graph-external-memory","name":"Retrieval, graph, and external learned memory","credits":4,"task_families":["retrieval","graph-reasoning","external-memory","provenance"],"allowed_worker_kinds":["local_cpu","wsl_workstation","github_hosted_cpu","self_hosted","remote_http"],"required_capabilities":["external-memory","provenance","artifact-receipts"],"max_cost_usd_per_experiment":12,"required_replications":2,"stop_rules":{"max_failed_attempts":4,"max_integrity_rejections":1,"stop_on_provenance_failure":true},"promotion_boundaries":{"minimum_seeds":3,"independent_evaluation":true,"retention_gate":true,"no_authority_regression":true}},{"id":"neuromorphic-energy-tensor-bio-inspired","name":"Neuromorphic, energy-based, tensor-network, and bio-inspired systems","credits":2,"task_families":["energy-based-inference","tensor-networks","neuromorphic-simulation","bio-inspired-learning"],"allowed_worker_kinds":["local_cpu","wsl_workstation","self_hosted","remote_http"],"required_capabilities":["simulator","artifact-receipts"],"max_cost_usd_per_experiment":10,"required_replications":1,"stop_rules":{"max_failed_attempts":3,"max_integrity_rejections":1,"stop_on_non_executable_hypothesis":true},"promotion_boundaries":{"minimum_seeds":3,"independent_evaluation":true,"classical_baseline":true,"no_authority_regression":true}},{"id":"quantum-quantum-inspired","name":"Quantum and quantum-inspired computation","credits":2,"task_families":["quantum-simulation","quantum-inspired-optimization","encoding-readout-accounting"],"allowed_worker_kinds":["local_cpu","wsl_workstation","github_hosted_cpu","self_hosted","remote_http"],"required_capabilities":["quantum-simulator","classical-baseline","artifact-receipts"],"max_cost_usd_per_experiment":10,"required_replications":1,"stop_rules":{"max_failed_attempts":3,"max_integrity_rejections":1,"stop_on_missing_classical_baseline":true},"promotion_boundaries":{"minimum_seeds":3,"independent_evaluation":true,"precise_advantage_hypothesis":true,"complete_encoding_readout_cost":true}}],"independent_evaluation":{"id":"independent-evaluation-replication","name":"Independent evaluation and replication","credits":20,"task_families":["hidden-evaluation","replication","adversarial-testing","receipt-verification"],"allowed_worker_kinds":["local_cpu","wsl_workstation","github_hosted_cpu","self_hosted","remote_http","burst_gpu"],"required_capabilities":["independent-judge","hidden-suite-access","receipt-verification"],"max_cost_usd_per_experiment":50,"required_replications":3,"stop_rules":{"reject_hidden_leakage":true,"reject_receipt_mismatch":true,"reject_tree_drift":true},"promotion_boundaries":{"minimum_seeds":3,"matched_compute":true,"authority_gate":true,"recovery_gate":true,"intervention_gate":true,"retention_gate":true}}}
